{"label":"Autogenerated Parse Tree (g1 ... g3)","$schema":"https://raw.githubusercontent.com/DbCrWk/graph-norm/development/schema/parse.tree/1.1.0.json","version":"1.1.0","vertices":["a","b","c","d","e","f","g","h","i","j","k","l","m","n","o","p","q","r","s"],"graphs":{"(g1 ... g3)":{"edges":[["a","a"],["a","b"],["a","c"],["a","d"],["a","r"],["a","g"],["a","j"],["a","e"],["a","q"],["a","s"],["a","h"],["a","i"],["a","k"],["b","b"],["b","a"],["b","c"],["b","d"],["b","r"],["b","g"],["b","j"],["b","e"],["b","q"],["b","s"],["b","h"],["b","i"],["b","k"],["b","f"],["b","p"],["c","c"],["c","a"],["c","b"],["c","d"],["c","g"],["c","j"],["c","r"],["c","e"],["c","h"],["c","i"],["c","k"],["c","q"],["c","s"],["c","f"],["c","n"],["d","d"],["d","b"],["d","c"],["d","e"],["d","a"],["d","r"],["d","g"],["d","j"],["d","f"],["d","q"],["d","s"],["d","h"],["d","i"],["d","k"],["d","p"],["r","r"],["r","b"],["r","q"],["r","s"],["r","a"],["r","c"],["r","d"],["r","p"],["r","g"],["r","j"],["r","e"],["r","f"],["g","g"],["g","c"],["g","h"],["g","i"],["g","j"],["g","a"],["g","b"],["g","d"],["g","k"],["g","r"],["g","e"],["g","n"],["j","j"],["j","c"],["j","g"],["j","k"],["j","a"],["j","b"],["j","d"],["j","h"],["j","i"],["j","n"],["j","r"],["j","e"],["j","l"],["j","m"],["j","o"],["e","e"],["e","d"],["e","f"],["e","b"],["e","c"],["e","p"],["e","a"],["e","r"],["e","g"],["e","j"],["e","q"],["q","q"],["q","p"],["q","r"],["q","f"],["q","b"],["q","s"],["q","e"],["q","a"],["q","c"],["q","d"],["s","s"],["s","r"],["s","b"],["s","q"],["s","a"],["s","c"],["s","d"],["s","p"],["h","h"],["h","g"],["h","i"],["h","c"],["h","j"],["h","a"],["h","b"],["h","d"],["h","k"],["i","i"],["i","g"],["i","h"],["i","c"],["i","j"],["i","a"],["i","b"],["i","d"],["i","k"],["k","k"],["k","j"],["k","n"],["k","c"],["k","g"],["k","l"],["k","m"],["k","o"],["k","a"],["k","b"],["k","d"],["k","h"],["k","i"],["f","f"],["f","e"],["f","p"],["f","d"],["f","q"],["f","b"],["f","c"],["f","r"],["p","p"],["p","f"],["p","q"],["p","e"],["p","r"],["p","d"],["p","b"],["p","s"],["n","n"],["n","k"],["n","l"],["n","m"],["n","o"],["n","j"],["n","c"],["n","g"],["l","l"],["l","m"],["l","n"],["l","k"],["l","o"],["l","j"],["m","m"],["m","l"],["m","n"],["m","k"],["m","o"],["m","j"],["o","o"],["o","n"],["o","k"],["o","l"],["o","m"],["o","j"]]},"(g1 ... g2)":{"edges":[["a","a"],["a","b"],["a","c"],["a","d"],["a","r"],["a","g"],["a","j"],["b","b"],["b","a"],["b","c"],["b","d"],["b","r"],["b","g"],["b","j"],["b","e"],["b","q"],["b","s"],["c","c"],["c","a"],["c","b"],["c","d"],["c","g"],["c","j"],["c","r"],["c","e"],["c","h"],["c","i"],["c","k"],["d","d"],["d","b"],["d","c"],["d","e"],["d","a"],["d","r"],["d","g"],["d","j"],["d","f"],["r","r"],["r","b"],["r","q"],["r","s"],["r","a"],["r","c"],["r","d"],["r","p"],["g","g"],["g","c"],["g","h"],["g","i"],["g","j"],["g","a"],["g","b"],["g","d"],["g","k"],["j","j"],["j","c"],["j","g"],["j","k"],["j","a"],["j","b"],["j","d"],["j","h"],["j","i"],["j","n"],["e","e"],["e","d"],["e","f"],["e","b"],["e","c"],["e","p"],["q","q"],["q","p"],["q","r"],["q","f"],["q","b"],["q","s"],["s","s"],["s","r"],["s","b"],["s","q"],["h","h"],["h","g"],["h","i"],["h","c"],["h","j"],["i","i"],["i","g"],["i","h"],["i","c"],["i","j"],["k","k"],["k","j"],["k","n"],["k","c"],["k","g"],["k","l"],["k","m"],["k","o"],["f","f"],["f","e"],["f","p"],["f","d"],["f","q"],["p","p"],["p","f"],["p","q"],["p","e"],["p","r"],["n","n"],["n","k"],["n","l"],["n","m"],["n","o"],["n","j"],["l","l"],["l","m"],["l","n"],["l","k"],["l","o"],["m","m"],["m","l"],["m","n"],["m","k"],["m","o"],["o","o"],["o","n"],["o","k"],["o","l"],["o","m"]]},"(g1 ... g1)":{"edges":[["a","a"],["a","b"],["a","c"],["b","b"],["b","a"],["b","c"],["b","d"],["b","r"],["c","c"],["c","a"],["c","b"],["c","d"],["c","g"],["c","j"],["d","d"],["d","b"],["d","c"],["d","e"],["e","e"],["e","d"],["e","f"],["f","f"],["f","e"],["f","p"],["g","g"],["g","c"],["g","h"],["g","i"],["g","j"],["h","h"],["h","g"],["h","i"],["i","i"],["i","g"],["i","h"],["j","j"],["j","c"],["j","g"],["j","k"],["k","k"],["k","j"],["k","n"],["l","l"],["l","m"],["l","n"],["m","m"],["m","l"],["m","n"],["n","n"],["n","k"],["n","l"],["n","m"],["n","o"],["o","o"],["o","n"],["p","p"],["p","f"],["p","q"],["q","q"],["q","p"],["q","r"],["r","r"],["r","b"],["r","q"],["r","s"],["s","s"],["s","r"]]},"g1":{"edges":[["a","a"],["a","b"],["a","c"],["b","b"],["b","a"],["b","c"],["b","d"],["b","r"],["c","c"],["c","a"],["c","b"],["c","d"],["c","g"],["c","j"],["d","d"],["d","b"],["d","c"],["d","e"],["e","e"],["e","d"],["e","f"],["f","f"],["f","e"],["f","p"],["g","g"],["g","c"],["g","h"],["g","i"],["g","j"],["h","h"],["h","g"],["h","i"],["i","i"],["i","g"],["i","h"],["j","j"],["j","c"],["j","g"],["j","k"],["k","k"],["k","j"],["k","n"],["l","l"],["l","m"],["l","n"],["m","m"],["m","l"],["m","n"],["n","n"],["n","k"],["n","l"],["n","m"],["n","o"],["o","o"],["o","n"],["p","p"],["p","f"],["p","q"],["q","q"],["q","p"],["q","r"],["r","r"],["r","b"],["r","q"],["r","s"],["s","s"],["s","r"]]},"g2":{"edges":[["a","a"],["a","b"],["a","c"],["b","b"],["b","a"],["b","c"],["b","d"],["b","r"],["c","c"],["c","a"],["c","b"],["c","d"],["c","g"],["c","j"],["d","d"],["d","b"],["d","c"],["d","e"],["e","e"],["e","d"],["e","f"],["f","f"],["f","e"],["f","p"],["g","g"],["g","c"],["g","h"],["g","i"],["g","j"],["h","h"],["h","g"],["h","i"],["i","i"],["i","g"],["i","h"],["j","j"],["j","c"],["j","g"],["j","k"],["k","k"],["k","j"],["k","n"],["l","l"],["l","m"],["l","n"],["m","m"],["m","l"],["m","n"],["n","n"],["n","k"],["n","l"],["n","m"],["n","o"],["o","o"],["o","n"],["p","p"],["p","f"],["p","q"],["q","q"],["q","p"],["q","r"],["r","r"],["r","b"],["r","q"],["r","s"],["s","s"],["s","r"]]},"g3":{"edges":[["a","a"],["a","b"],["a","c"],["b","b"],["b","a"],["b","c"],["b","d"],["b","r"],["c","c"],["c","a"],["c","b"],["c","d"],["c","g"],["c","j"],["d","d"],["d","b"],["d","c"],["d","e"],["e","e"],["e","d"],["e","f"],["f","f"],["f","e"],["f","p"],["g","g"],["g","c"],["g","h"],["g","i"],["g","j"],["h","h"],["h","g"],["h","i"],["i","i"],["i","g"],["i","h"],["j","j"],["j","c"],["j","g"],["j","k"],["k","k"],["k","j"],["k","n"],["l","l"],["l","m"],["l","n"],["m","m"],["m","l"],["m","n"],["n","n"],["n","k"],["n","l"],["n","m"],["n","o"],["o","o"],["o","n"],["p","p"],["p","f"],["p","q"],["q","q"],["q","p"],["q","r"],["r","r"],["r","b"],["r","q"],["r","s"],["s","s"],["s","r"]]}},"sequence":["g1","g2","g3"],"temporal":{"label":"Autogenerated ((g1 ... g3))","version":"1.0.0","root":{"category":"sequence","label":"(g1 ... g3)","isTransitive":false,"children":[{"category":"sequence","label":"(g1 ... g2)","isTransitive":false,"children":[{"category":"sequence","label":"(g1 ... g1)","isTransitive":false,"children":[{"category":"graph","label":"g1","isTransitive":false}]},{"category":"graph","label":"g2","isTransitive":false}]},{"category":"graph","label":"g3","isTransitive":false}]}},"topological":{"label":"Autogenerated (root)","version":"1.0.0","root":{"category":"root","label":"root","children":[{"category":"sequence","label":"(g1 ... g3): o","clique":"o","children":[{"category":"sequence","label":"(g1 ... g2): o","clique":"o","children":[{"category":"sequence","label":"(g1 ... g1): o","clique":"o","children":[]},{"category":"sequence","label":"(g1 ... g1): s","clique":"s","children":[]},{"category":"sequence","label":"(g1 ... g1): i","clique":"i","children":[]},{"category":"sequence","label":"(g1 ... g1): n","clique":"n","children":[]}]},{"category":"sequence","label":"(g1 ... g2): p","clique":"p","children":[{"category":"sequence","label":"(g1 ... g1): s","clique":"s","children":[]}]},{"category":"sequence","label":"(g1 ... g2): q","clique":"q","children":[{"category":"sequence","label":"(g1 ... g1): s","clique":"s","children":[]}]}]},{"category":"sequence","label":"(g1 ... g3): p","clique":"p","children":[{"category":"sequence","label":"(g1 ... g2): p","clique":"p","children":[{"category":"sequence","label":"(g1 ... g1): s","clique":"s","children":[]}]},{"category":"sequence","label":"(g1 ... g2): q","clique":"q","children":[{"category":"sequence","label":"(g1 ... g1): s","clique":"s","children":[]}]}]}]}}}
