{"label":"Autogenerated Parse Tree (g1 ... g8)","$schema":"https://raw.githubusercontent.com/DbCrWk/graph-norm/development/schema/parse.tree/1.1.0.json","version":"1.1.0","vertices":["a","b","c","d","e","f","g","h"],"graphs":{"(g1 ... g8)":{"edges":[["a","a"],["a","h"],["a","b"],["a","g"],["a","c"],["a","f"],["a","d"],["a","e"],["h","h"],["h","g"],["h","a"],["h","f"],["h","b"],["h","e"],["h","c"],["h","d"],["b","b"],["b","a"],["b","c"],["b","h"],["b","d"],["b","g"],["b","e"],["b","f"],["g","g"],["g","f"],["g","h"],["g","e"],["g","a"],["g","d"],["g","b"],["g","c"],["c","c"],["c","b"],["c","d"],["c","a"],["c","e"],["c","h"],["c","f"],["c","g"],["f","f"],["f","e"],["f","g"],["f","d"],["f","h"],["f","c"],["f","a"],["f","b"],["d","d"],["d","c"],["d","e"],["d","b"],["d","f"],["d","a"],["d","g"],["d","h"],["e","e"],["e","d"],["e","f"],["e","c"],["e","g"],["e","b"],["e","h"],["e","a"]]},"(g1 ... g6)":{"edges":[["a","a"],["a","h"],["a","b"],["a","g"],["a","c"],["a","f"],["a","d"],["h","h"],["h","g"],["h","a"],["h","f"],["h","b"],["h","e"],["h","c"],["b","b"],["b","a"],["b","c"],["b","h"],["b","d"],["b","g"],["b","e"],["g","g"],["g","f"],["g","h"],["g","e"],["g","a"],["g","d"],["g","b"],["c","c"],["c","b"],["c","d"],["c","a"],["c","e"],["c","h"],["c","f"],["f","f"],["f","e"],["f","g"],["f","d"],["f","h"],["f","c"],["f","a"],["d","d"],["d","c"],["d","e"],["d","b"],["d","f"],["d","a"],["d","g"],["e","e"],["e","d"],["e","f"],["e","c"],["e","g"],["e","b"],["e","h"]]},"(g1 ... g5)":{"edges":[["a","a"],["a","b"],["a","h"],["a","c"],["a","g"],["a","d"],["b","b"],["b","c"],["b","a"],["b","d"],["b","h"],["b","e"],["h","h"],["h","a"],["h","g"],["h","b"],["h","f"],["h","c"],["c","c"],["c","d"],["c","b"],["c","e"],["c","a"],["c","f"],["g","g"],["g","h"],["g","f"],["g","a"],["g","e"],["g","b"],["d","d"],["d","e"],["d","c"],["d","f"],["d","b"],["d","g"],["f","f"],["f","g"],["f","e"],["f","h"],["f","d"],["f","a"],["e","e"],["e","f"],["e","d"],["e","g"],["e","c"],["e","h"]]},"(g1 ... g4)":{"edges":[["a","a"],["a","h"],["a","b"],["a","g"],["a","c"],["h","h"],["h","g"],["h","a"],["h","f"],["h","b"],["b","b"],["b","a"],["b","c"],["b","h"],["b","d"],["g","g"],["g","f"],["g","h"],["g","e"],["g","a"],["c","c"],["c","b"],["c","d"],["c","a"],["c","e"],["d","d"],["d","c"],["d","e"],["d","b"],["d","f"],["f","f"],["f","e"],["f","g"],["f","d"],["f","h"],["e","e"],["e","d"],["e","f"],["e","c"],["e","g"]]},"(g1 ... g3)":{"edges":[["a","a"],["a","b"],["a","h"],["a","c"],["b","b"],["b","c"],["b","a"],["b","d"],["h","h"],["h","a"],["h","g"],["h","b"],["c","c"],["c","d"],["c","b"],["c","e"],["g","g"],["g","h"],["g","f"],["g","a"],["d","d"],["d","e"],["d","c"],["d","f"],["e","e"],["e","f"],["e","d"],["e","g"],["f","f"],["f","g"],["f","e"],["f","h"]]},"(g1 ... g2)":{"edges":[["a","a"],["a","h"],["a","b"],["h","h"],["h","g"],["h","a"],["b","b"],["b","a"],["b","c"],["c","c"],["c","b"],["c","d"],["d","d"],["d","c"],["d","e"],["e","e"],["e","d"],["e","f"],["f","f"],["f","e"],["f","g"],["g","g"],["g","f"],["g","h"]]},"(g1 ... g1)":{"edges":[["a","a"],["a","b"],["b","b"],["b","c"],["c","c"],["c","d"],["d","d"],["d","e"],["e","e"],["e","f"],["f","f"],["f","g"],["g","g"],["g","h"],["h","h"],["h","a"]]},"g1":{"edges":[["a","a"],["a","b"],["b","b"],["b","c"],["c","c"],["c","d"],["d","d"],["d","e"],["e","e"],["e","f"],["f","f"],["f","g"],["g","g"],["g","h"],["h","h"],["h","a"]]},"g2":{"edges":[["a","a"],["a","h"],["b","b"],["b","a"],["c","c"],["c","b"],["d","d"],["d","c"],["e","e"],["e","d"],["f","f"],["f","e"],["g","g"],["g","f"],["h","h"],["h","g"]]},"g3":{"edges":[["a","a"],["a","b"],["b","b"],["b","c"],["c","c"],["c","d"],["d","d"],["d","e"],["e","e"],["e","f"],["f","f"],["f","g"],["g","g"],["g","h"],["h","h"],["h","a"]]},"g4":{"edges":[["a","a"],["a","h"],["b","b"],["b","a"],["c","c"],["c","b"],["d","d"],["d","c"],["e","e"],["e","d"],["f","f"],["f","e"],["g","g"],["g","f"],["h","h"],["h","g"]]},"g5":{"edges":[["a","a"],["a","b"],["b","b"],["b","c"],["c","c"],["c","d"],["d","d"],["d","e"],["e","e"],["e","f"],["f","f"],["f","g"],["g","g"],["g","h"],["h","h"],["h","a"]]},"g6":{"edges":[["a","a"],["a","h"],["b","b"],["b","a"],["c","c"],["c","b"],["d","d"],["d","c"],["e","e"],["e","d"],["f","f"],["f","e"],["g","g"],["g","f"],["h","h"],["h","g"]]},"g7":{"edges":[["a","a"],["a","b"],["b","b"],["b","c"],["c","c"],["c","d"],["d","d"],["d","e"],["e","e"],["e","f"],["f","f"],["f","g"],["g","g"],["g","h"],["h","h"],["h","a"]]},"(g8 ... g8)":{"edges":[["a","a"],["a","h"],["b","b"],["b","a"],["c","c"],["c","b"],["d","d"],["d","c"],["e","e"],["e","d"],["f","f"],["f","e"],["g","g"],["g","f"],["h","h"],["h","g"]]},"g8":{"edges":[["a","a"],["a","h"],["b","b"],["b","a"],["c","c"],["c","b"],["d","d"],["d","c"],["e","e"],["e","d"],["f","f"],["f","e"],["g","g"],["g","f"],["h","h"],["h","g"]]}},"sequence":["g1","g2","g3","g4","g5","g6","g7","g8"],"temporal":{"label":"Autogenerated ((g1 ... g8))","version":"1.0.0","root":{"category":"sequence","label":"(g1 ... g8)","isTransitive":true,"children":[{"category":"sequence","label":"(g1 ... g6)","isTransitive":false,"children":[{"category":"sequence","label":"(g1 ... g5)","isTransitive":false,"children":[{"category":"sequence","label":"(g1 ... g4)","isTransitive":false,"children":[{"category":"sequence","label":"(g1 ... g3)","isTransitive":false,"children":[{"category":"sequence","label":"(g1 ... g2)","isTransitive":false,"children":[{"category":"sequence","label":"(g1 ... g1)","isTransitive":false,"children":[{"category":"graph","label":"g1","isTransitive":false}]},{"category":"graph","label":"g2","isTransitive":false}]},{"category":"graph","label":"g3","isTransitive":false}]},{"category":"graph","label":"g4","isTransitive":false}]},{"category":"graph","label":"g5","isTransitive":false}]},{"category":"graph","label":"g6","isTransitive":false}]},{"category":"graph","label":"g7","isTransitive":false},{"category":"sequence","label":"(g8 ... g8)","isTransitive":false,"children":[{"category":"graph","label":"g8","isTransitive":false}]}]}},"topological":{"label":"Autogenerated (root)","version":"1.0.0","root":{"category":"root","label":"root","children":[{"category":"sequence","label":"(g1 ... g8): b","clique":"b","children":[{"category":"sequence","label":"(g1 ... g6): b","clique":"b","children":[{"category":"sequence","label":"(g1 ... g5): h","clique":"h","children":[{"category":"sequence","label":"(g1 ... g4): b","clique":"b","children":[{"category":"sequence","label":"(g1 ... g3): h","clique":"h","children":[{"category":"sequence","label":"(g1 ... g2): b","clique":"b","children":[{"category":"sequence","label":"(g1 ... g1): h","clique":"h","children":[]}]}]}]}]}]},{"category":"sequence","label":"(g8 ... g8): b","clique":"b","children":[]}]}]}}}
