{"label":"Autogenerated Parse Tree (g1 ... g8)","$schema":"https://raw.githubusercontent.com/DbCrWk/graph-norm/development/schema/parse.tree/1.1.0.json","version":"1.1.0","vertices":["a","b","c","d","e","f","g","h"],"graphs":{"(g1 ... g8)":{"edges":[["a","a"],["a","d"],["a","b"],["a","c"],["d","d"],["d","c"],["d","a"],["d","b"],["b","b"],["b","a"],["b","c"],["b","d"],["c","c"],["c","b"],["c","d"],["c","a"],["e","e"],["e","h"],["e","f"],["e","g"],["h","h"],["h","g"],["h","e"],["h","f"],["f","f"],["f","e"],["f","g"],["f","h"],["g","g"],["g","f"],["g","h"],["g","e"]]},"(g1 ... g2)":{"edges":[["a","a"],["a","d"],["a","b"],["d","d"],["d","c"],["d","a"],["b","b"],["b","a"],["b","c"],["c","c"],["c","b"],["c","d"],["e","e"],["e","h"],["e","f"],["h","h"],["h","g"],["h","e"],["f","f"],["f","e"],["f","g"],["g","g"],["g","f"],["g","h"]]},"(g1 ... g1)":{"edges":[["a","a"],["a","b"],["b","b"],["b","c"],["c","c"],["c","d"],["d","d"],["d","a"],["e","e"],["e","f"],["f","f"],["f","g"],["g","g"],["g","h"],["h","h"],["h","e"]]},"g1":{"edges":[["a","a"],["a","b"],["b","b"],["b","c"],["c","c"],["c","d"],["d","d"],["d","a"],["e","e"],["e","f"],["f","f"],["f","g"],["g","g"],["g","h"],["h","h"],["h","e"]]},"g2":{"edges":[["a","a"],["a","d"],["b","b"],["b","a"],["c","c"],["c","b"],["d","d"],["d","c"],["e","e"],["e","h"],["f","f"],["f","e"],["g","g"],["g","f"],["h","h"],["h","g"]]},"g3":{"edges":[["a","a"],["a","b"],["b","b"],["b","c"],["c","c"],["c","d"],["d","d"],["d","a"],["e","e"],["e","f"],["f","f"],["f","g"],["g","g"],["g","h"],["h","h"],["h","e"]]},"(g4 ... g5)":{"edges":[["a","a"],["a","b"],["a","d"],["b","b"],["b","c"],["b","a"],["d","d"],["d","a"],["d","c"],["c","c"],["c","d"],["c","b"],["e","e"],["e","f"],["e","h"],["f","f"],["f","g"],["f","e"],["h","h"],["h","e"],["h","g"],["g","g"],["g","h"],["g","f"]]},"(g4 ... g4)":{"edges":[["a","a"],["a","d"],["b","b"],["b","a"],["c","c"],["c","b"],["d","d"],["d","c"],["e","e"],["e","h"],["f","f"],["f","e"],["g","g"],["g","f"],["h","h"],["h","g"]]},"g4":{"edges":[["a","a"],["a","d"],["b","b"],["b","a"],["c","c"],["c","b"],["d","d"],["d","c"],["e","e"],["e","h"],["f","f"],["f","e"],["g","g"],["g","f"],["h","h"],["h","g"]]},"g5":{"edges":[["a","a"],["a","b"],["b","b"],["b","c"],["c","c"],["c","d"],["d","d"],["d","a"],["e","e"],["e","f"],["f","f"],["f","g"],["g","g"],["g","h"],["h","h"],["h","e"]]},"g6":{"edges":[["a","a"],["a","d"],["b","b"],["b","a"],["c","c"],["c","b"],["d","d"],["d","c"],["e","e"],["e","h"],["f","f"],["f","e"],["g","g"],["g","f"],["h","h"],["h","g"]]},"(g7 ... g8)":{"edges":[["a","a"],["a","d"],["a","b"],["d","d"],["d","c"],["d","a"],["b","b"],["b","a"],["b","c"],["c","c"],["c","b"],["c","d"],["e","e"],["e","h"],["e","f"],["h","h"],["h","g"],["h","e"],["f","f"],["f","e"],["f","g"],["g","g"],["g","f"],["g","h"]]},"(g7 ... g7)":{"edges":[["a","a"],["a","b"],["b","b"],["b","c"],["c","c"],["c","d"],["d","d"],["d","a"],["e","e"],["e","f"],["f","f"],["f","g"],["g","g"],["g","h"],["h","h"],["h","e"]]},"g7":{"edges":[["a","a"],["a","b"],["b","b"],["b","c"],["c","c"],["c","d"],["d","d"],["d","a"],["e","e"],["e","f"],["f","f"],["f","g"],["g","g"],["g","h"],["h","h"],["h","e"]]},"g8":{"edges":[["a","a"],["a","d"],["b","b"],["b","a"],["c","c"],["c","b"],["d","d"],["d","c"],["e","e"],["e","h"],["f","f"],["f","e"],["g","g"],["g","f"],["h","h"],["h","g"]]}},"sequence":["g1","g2","g3","g4","g5","g6","g7","g8"],"temporal":{"label":"Autogenerated ((g1 ... g8))","version":"1.0.0","root":{"category":"sequence","label":"(g1 ... g8)","isTransitive":true,"children":[{"category":"sequence","label":"(g1 ... g2)","isTransitive":false,"children":[{"category":"sequence","label":"(g1 ... g1)","isTransitive":false,"children":[{"category":"graph","label":"g1","isTransitive":false}]},{"category":"graph","label":"g2","isTransitive":false}]},{"category":"graph","label":"g3","isTransitive":false},{"category":"sequence","label":"(g4 ... g5)","isTransitive":false,"children":[{"category":"sequence","label":"(g4 ... g4)","isTransitive":false,"children":[{"category":"graph","label":"g4","isTransitive":false}]},{"category":"graph","label":"g5","isTransitive":false}]},{"category":"graph","label":"g6","isTransitive":false},{"category":"sequence","label":"(g7 ... g8)","isTransitive":false,"children":[{"category":"sequence","label":"(g7 ... g7)","isTransitive":false,"children":[{"category":"graph","label":"g7","isTransitive":false}]},{"category":"graph","label":"g8","isTransitive":false}]}]}},"topological":{"label":"Autogenerated (root)","version":"1.0.0","root":{"category":"root","label":"root","children":[{"category":"sequence","label":"(g1 ... g8): b","clique":"b","children":[{"category":"sequence","label":"(g1 ... g2): b","clique":"b","children":[{"category":"sequence","label":"(g1 ... g1): d","clique":"d","children":[]}]},{"category":"sequence","label":"(g4 ... g5): d","clique":"d","children":[{"category":"sequence","label":"(g4 ... g4): b","clique":"b","children":[]}]},{"category":"sequence","label":"(g7 ... g8): b","clique":"b","children":[{"category":"sequence","label":"(g7 ... g7): d","clique":"d","children":[]}]}]},{"category":"sequence","label":"(g1 ... g8): f","clique":"f","children":[{"category":"sequence","label":"(g1 ... g2): f","clique":"f","children":[{"category":"sequence","label":"(g1 ... g1): h","clique":"h","children":[]}]},{"category":"sequence","label":"(g4 ... g5): h","clique":"h","children":[{"category":"sequence","label":"(g4 ... g4): f","clique":"f","children":[]}]},{"category":"sequence","label":"(g7 ... g8): f","clique":"f","children":[{"category":"sequence","label":"(g7 ... g7): h","clique":"h","children":[]}]}]}]}}}
