{"label":"Autogenerated Parse Tree (g1 ... g7)","$schema":"https://raw.githubusercontent.com/DbCrWk/graph-norm/development/schema/parse.tree/1.1.0.json","version":"1.1.0","vertices":["a","b","c","d","e","f"],"graphs":{"(g1 ... g7)":{"edges":[["a","a"],["a","b"],["a","c"],["a","d"],["b","b"],["b","a"],["b","c"],["b","d"],["c","c"],["c","d"],["c","a"],["c","b"],["d","d"],["d","c"],["d","a"],["d","b"],["d","f"],["d","e"],["f","f"],["f","e"],["f","d"],["f","c"],["e","e"],["e","f"],["e","d"],["e","c"],["e","a"],["e","b"]]},"(g1 ... g3)":{"edges":[["a","a"],["a","b"],["a","c"],["a","d"],["b","b"],["b","a"],["b","c"],["b","d"],["c","c"],["c","a"],["c","d"],["c","b"],["d","d"],["d","c"],["d","a"],["d","b"],["d","f"],["d","e"],["f","f"],["f","e"],["f","d"],["f","c"],["e","e"],["e","f"],["e","d"],["e","c"],["e","a"]]},"(g1 ... g2)":{"edges":[["a","a"],["a","b"],["a","c"],["b","b"],["b","a"],["b","c"],["b","d"],["c","c"],["c","a"],["c","d"],["c","b"],["d","d"],["d","c"],["d","a"],["d","f"],["d","e"],["f","f"],["f","e"],["f","d"],["e","e"],["e","d"],["e","f"],["e","c"]]},"(g1 ... g1)":{"edges":[["a","a"],["a","b"],["b","b"],["b","a"],["b","c"],["c","c"],["c","a"],["c","d"],["d","d"],["d","c"],["d","f"],["e","e"],["e","d"],["e","f"],["f","f"],["f","e"]]},"g1":{"edges":[["a","a"],["a","b"],["b","b"],["b","a"],["b","c"],["c","c"],["c","a"],["c","d"],["d","d"],["d","c"],["d","f"],["e","e"],["e","d"],["e","f"],["f","f"],["f","e"]]},"g2":{"edges":[["a","a"],["a","b"],["b","b"],["b","a"],["b","c"],["c","c"],["c","a"],["c","d"],["d","d"],["d","c"],["e","e"],["e","d"],["e","f"],["f","f"],["f","e"]]},"g3":{"edges":[["a","a"],["a","b"],["b","b"],["b","a"],["c","c"],["c","a"],["c","d"],["d","d"],["d","c"],["e","e"],["e","f"],["f","f"],["f","e"]]},"g4":{"edges":[["a","a"],["a","b"],["b","b"],["b","a"],["c","c"],["c","d"],["d","d"],["d","c"],["e","e"],["e","f"],["f","f"],["f","e"]]},"(g5 ... g7) △ tf(g1×g2×g3×g4×g5×g6×g7)":{"edges":[["a","a"],["a","b"],["a","c"],["a","d"],["b","b"],["b","a"],["b","c"],["b","d"],["c","c"],["c","d"],["d","d"],["d","c"],["f","f"],["f","e"],["f","d"],["f","c"],["e","e"],["e","f"],["e","d"],["e","c"]]},"(g5 ... g7)":{"edges":[["a","a"],["a","b"],["b","b"],["b","a"],["c","c"],["c","d"],["d","d"],["d","c"],["e","e"],["f","f"]]},"g5":{"edges":[["a","a"],["a","b"],["b","b"],["b","a"],["c","c"],["c","d"],["d","d"],["d","c"],["e","e"],["f","f"]]},"(g6 ... g7)":{"edges":[["a","a"],["a","b"],["b","b"],["b","a"],["c","c"],["d","d"],["e","e"],["f","f"]]},"g6":{"edges":[["a","a"],["a","b"],["b","b"],["b","a"],["c","c"],["d","d"],["e","e"],["f","f"]]},"(g7 ... g7)":{"edges":[["a","a"],["b","b"],["c","c"],["d","d"],["e","e"],["f","f"]]},"g7":{"edges":[["a","a"],["b","b"],["c","c"],["d","d"],["e","e"],["f","f"]]}},"sequence":["g1","g2","g3","g4","g5","g6","g7"],"temporal":{"label":"Autogenerated ((g1 ... g7))","version":"1.0.0","root":{"category":"sequence","label":"(g1 ... g7)","isTransitive":false,"children":[{"category":"sequence","label":"(g1 ... g3)","isTransitive":false,"children":[{"category":"sequence","label":"(g1 ... g2)","isTransitive":false,"children":[{"category":"sequence","label":"(g1 ... g1)","isTransitive":false,"children":[{"category":"graph","label":"g1","isTransitive":false}]},{"category":"graph","label":"g2","isTransitive":false}]},{"category":"graph","label":"g3","isTransitive":false}]},{"category":"graph","label":"g4","isTransitive":true},{"category":"special","label":"(g5 ... g7) △ tf(g1×g2×g3×g4×g5×g6×g7)","children":[{"category":"sequence","label":"(g5 ... g7)","isTransitive":true,"children":[{"category":"graph","label":"g5","isTransitive":true},{"category":"sequence","label":"(g6 ... g7)","isTransitive":true,"children":[{"category":"graph","label":"g6","isTransitive":true},{"category":"sequence","label":"(g7 ... g7)","isTransitive":true,"children":[{"category":"graph","label":"g7","isTransitive":true}]}]}]}]}]}},"topological":{"label":"Autogenerated (root)","version":"1.0.0","root":{"category":"root","label":"root","children":[{"category":"sequence","label":"(g1 ... g7): e","clique":"e","children":[{"category":"sequence","label":"(g1 ... g3): e","clique":"e","children":[{"category":"sequence","label":"(g1 ... g2): e","clique":"e","children":[{"category":"sequence","label":"(g1 ... g1): e","clique":"e","children":[]}]}]},{"category":"special","label":"(g5 ... g7) △ tf(g1×g2×g3×g4×g5×g6×g7): d","clique":"d","children":[{"category":"sequence","label":"(g5 ... g7): b","clique":"b","children":[{"category":"sequence","label":"(g6 ... g7): b","clique":"b","children":[{"category":"sequence","label":"(g7 ... g7): a","clique":"a","children":[]},{"category":"sequence","label":"(g7 ... g7): b","clique":"b","children":[]}]}]},{"category":"sequence","label":"(g5 ... g7): d","clique":"d","children":[{"category":"sequence","label":"(g6 ... g7): c","clique":"c","children":[{"category":"sequence","label":"(g7 ... g7): c","clique":"c","children":[]}]},{"category":"sequence","label":"(g6 ... g7): d","clique":"d","children":[{"category":"sequence","label":"(g7 ... g7): d","clique":"d","children":[]}]}]}]}]}]}}}
